,,,,,,,,,,,,,,,,,
Stanford University,,"Tens of thousands of past and current Stanford University employees had personal information - including their dates of birth, Social Security numbers and home addresses - stored on the hard drive of a stolen university laptop.",4,"72,000",academic,lost / stolen computer,,72000,20,,,,,http://www.idtheftcenter.org/artman2/publish/lib_survey/ITRC_2008_Breach_List.shtml,http://www.sfgate.com/bayarea/article/Stanford-employees-data-on-stolen-laptop-3281185.php,,ITRC
UK Home Office,,"PA Consulting lost an unencrypted memory stick containing details of high risk, prolific and other offenders.",4,"84,000",government,lost / stolen media,,84000,20,,,,,http://en.wikipedia.org/wiki/List_of_UK_government_data_losses,,,Wikipedia
Starbucks,,"A laptop was stolen that contained private information on 97,000 employees, including names, addresses and Social Security numbers. Employees tried to sue Starbucks in California winning their case in the appeals court before losing in the higher federal court as they were unable to prove any cognizable harm or injury.",4,"97,000",retail,lost / stolen computer,,100000,20,,,,,http://www.idtheftcenter.org/artman2/publish/lib_survey/ITRC_2008_Breach_List.shtml,http://privacyblog.littler.com/2011/01/articles/identity-theft/after-starbucks-laptop-is-stolen-alleged-victims-of-identity-theft-win-pyrrhic-victory/,,ITRC
AT&T,,"A laptop was stolen from a car containing unencrypted Social
Security numbers and bonus/salary info of AT&T employees.",4,"113,000",telecoms,lost / stolen computer,,100000,1,,,,,http://www.idtheftcenter.org/artman2/publish/lib_survey/ITRC_2008_Breach_List.shtml,,,ITRC
RBS Worldpay,the U.S. payment processing arm of The Royal Bank of Scotland Group,"The hack primarily effected U.S. prepaid and the gift card issuing business of RBS Worldpay. Actual fraud has been committed on approximately 100 cards.  Certain personal information of approximately 1.5 million cardholders and other individuals may have been affected and, of this group, Social Security numbers of 1.1 million people may have been accessed.",4,"1,500,000",financial,hacked,,1500000,20,,,,,http://www.theregister.co.uk/2008/12/29/rbs_worldpay_breach/,,,The Register
Jefferson County,"West Virginia, US","""Jefferson County Clerk Jennifer Maghan said she unveiled a new online search tool that enabled residents and business professionals to access nearly 1.6 million documents that are stored in her office via their home computers""",4,"1,600,000",government,accidentally published,,1600000,20,,,,,http://www.idtheftcenter.org/artman2/publish/lib_survey/ITRC_2008_Breach_List.shtml,http://www.journal-news.net/page/content.detail/id/511806.html?nav=5006,,ITRC
UK Ministry of Defence,,"Hard drive containing very sensitive details of Armed Forces personnel - passport & national insurance numbers, bank details etc - went missing. Loss was revealed during National Identity Fraud Prevention Week. ",4,"1,700,000",government,lost / stolen media,,1700000,50000,,,,,http://news.bbc.co.uk/1/hi/uk_politics/7667507.stm,,,BBC
University of Miami,,"Thieves stole a briefcase containing data tapes out of a vehicle used by a private off-site storage company. Anyone who had been a patient of a University of Miami physician or visited a UM facility since 1999 is likely included on the tapes. The data included names, addresses, Social Security numbers and health information. 47,000 of these records may have included credit card or other financial information regarding bill payment.",4,"2,100,000",academic,lost / stolen computer,,2100000,300,,,,,http://www.idtheftcenter.org/artman2/publish/lib_survey/ITRC_2008_Breach_List.shtml,,,ITRC
University of Utah Hospitals & Clinics,stolen data tapes,The data tapes were stolen by petty thieves from an employee's car. According to police reports the thieves tried - and failed - to view the tapes using a VHS player.,4,"2,200,000",academic,lost / stolen media,,2200000,4000,,,,,http://www.idtheftcenter.org/artman2/publish/lib_survey/ITRC_2008_Breach_List.shtml,,,ITRC
Norwegian Tax Authorities,,"""Tax authorities said they had accidentally sent CD-ROMs filled with the 2006 tax returns of nearly four million people living in Norway, a country of 
just 4.6 million inhabitants, to the editorial staff at national 
newspapers, radios and television stations.""",4,"3,950,000",government,accidentally published,,4000000,20,,,,,http://infowatch.com/node/1289,,,Info Watch
Data Processors International,Provides merchant account establishment and Internet based credit card payment processing services,,4,"5,000,000",financial,hacked,,5000000,1,,,,,http://money.cnn.com/2003/02/18/technology/creditcards/,,,CNN
Chile Ministry Of Education,,A computer hacker in Chile published confidential records belonging to six million people to illustrate the weakness of their security. ,4,"6,000,000",government,accidentally published,,6000000,1,,,,,http://news.bbc.co.uk/2/hi/americas/7395295.stm,http://www.geek.com/articles/news/government-servers-in-chile-hacked-6-million-personal-records-made-public-20080514/,,BBC News
GS Caltex,Private oil company,"Two multimedia discs containing the names, social security numbers, addresses, cell phone numbers, email addresses and workplaces of Korean customers sorted by age were stolen. They were found by an office worker in a backstreet’s trash pile in Seoul. Experts say a GS Caltex employee likely stole the information for personal purposes given there were no signs of hacking.",4,"11,100,000",energy,inside job,,11100000,20,,,,,http://www.datalossdb.org,http://english.donga.com/srv/service.php3?biid=2008090631088,,Data Loss Database
BNY Mellon Shareowner Services,Wealth management,"A back-up tape, containing over 12 million customers records were lost.",4,"12,500,000",financial,lost / stolen media ,,12500000,1,,,,,http://www.wctv.tv/news/headlines/28132494.html?storySection=comments,,,ITRC
Auction.co.kr,South Korea's largest online shopping site,,4,"18,000,000",web,hacked,,18000000,300,,,,,http://www.darkreading.com/security/perimeter-security/211201111/hacker-steals-data-on-18m-auction-customers-in-south-korea.html,,,Darkreading
Texas Lottery,,"Data on more than 89,000 lottery winners (including names, Social Security numbers, addresses and prize amounts )were taken from the agency without permission by a former computer analyst who copied the password-free data. The employee added he wanted the information ""for possible future reference as a programmer at other state agencies.""",3,"89,000",government,inside job,,90000,20,,,,,http://www.idtheftcenter.org/artman2/publish/lib_survey/ITRC_2008_Breach_List.shtml,,,ITRC
City and Hackney Teaching Primary Care Trust,,Heavily encrypted disks containing details of children are lost by couriers.,3,"160,000",government,lost / stolen media,,160000,20,,,,,http://www.computerweekly.com/news/2240104003/Hackney-NHS-trust-encrypts-IT-equipment-following-loss-of-child-data,,,Computer Weekly
Gap Inc,,"Stolen laptop which contained social security numbers, data on people who applied for positions at Gap stores, including Banana Republic and Old Navy, between July 2006 and June 2007.",3,"800,000",retail,lost / stolen computer,,800000,20,,,,,http://www.pcworld.com/article/137865/article.html,,,PC World
Compass Bank,,"A former employee stole a hardrive containing 1m account details from the bank, then used it to defraud cutomers of nearly $32,000.",3,"1,000,000",financial,inside job,,1000000,300,,,,,http://www.idtheftcenter.org/artman2/publish/lib_survey/ITRC_2008_Breach_List.shtml,http://www.computerworld.com/s/article/9072198/Programmer_who_stole_drive_containing_1_million_bank_records_gets_42_months,,ITRC
Monster.com,Jobs website,"A trojan virus stole log-ins that were used to harvest user names, e-mail addresses, home addresses and phone numbers. Soon after phishing e-mails encouraged users to download a Monster Job Seeker Tool, which was in fact a program that encrypted files in their computer and left a ransom note demanding money for their decryption.

",3,"1,600,000",web,hacked,,1600000,20,,,,,http://news.bbc.co.uk/1/hi/6956349.stm,,,BBC
Driving Standards Agency,,"Hard disk with details of candidates for the driving theory test was lost in a premises in Iowa by subcontractors. Only names, addresses and phone numbers. ",3,"3,000,000",government,lost / stolen media,,3000000,20,,,,,http://news.bbc.co.uk/1/hi/uk_politics/7147715.stm,,,BBC
"Driving Standards Agency,",Details of candidates for the driving theory test were on a hard drive that went missing in the US. ,,3,"3,000,000",government,lost / stolen media,,3000000,20,,,,,http://news.bbc.co.uk/1/hi/uk_politics/7147715.stm,,,BBC
Hannaford Brothers Supermarket Chain,"Delhaize Group: Hannaford Bros, Sweetbay, Food Lion, Bloom, Bottom Dollar, Harveys, Kash n' Karry",An estimated 4.2 million credit and debit card numbers were stolen.,3,"4,200,000",retail,hacked,,4200000,300,,,,,http://www.idtheftcenter.org/artman2/publish/lib_survey/ITRC_2008_Breach_List.shtml,,,ITRC
TD Ameritrade,US online broker,TD Ameritrade settled a class action lawsuit to compensate as many as 6.3 million TD Ameritrade customers whose data was stolen by hackers costing the Nebraska online brokerage firm less than $2 per victim.,3,"6,300,000",financial,hacked,,6300000,1,,,,,http://www.wired.com/threatlevel/2008/07/ameritrade-hack/,,,Wired
Fidelity National Information Services,"Employee sold customer information to a data broker, including names, addresses, birth dates, bank account and credit card information.",,3,"8,500,000",financial,inside job,,8500000,300,,,,,http://www.pcworld.com/article/135117/article.html,,,PC World
Dai Nippon Printing,Japanese printing company,"A former contractor of Dai Nippon Printing Company in Tokyo, Japan stole 8.6 million records containing the personal data of customers of 43 of the company's clients. ",3,"8,637,405",retail,inside job,,8600000,1,,,,,http://usatoday30.usatoday.com/tech/news/computersecurity/2007-12-30-data_n.htm,,,USA Today
UK Revenue & Customs,HMRC,A set of discs containing confidential details of 25 million child benefit recipients was lost.,3,"25,000,000",government,lost / stolen media ,,25000000,1,,,,,http://news.bbc.co.uk/2/hi/uk_news/7103911.stm,,,BBC News
TK / TJ Maxx,Largest retail breach to date,"Hackers hacked a Minnesota store wifi network and stole data from credit and debit cards of shoppers at off-price retailers TJX, owners of nearly 2,500 stores, including T.J. Maxx and Marshalls. This case is believed to be the largest such breach of consumer information.",3,"94,000,000",retail,hacked,,94000000,300,,,,,http://www.zdnet.com/wi-fi-hack-caused-tk-maxx-security-breach-3039286991/,http://www.msnbc.msn.com/id/17871485/ns/technology_and_science-security/t/tj-maxx-theft-believed-largest-hack-ever/#.UFi-HaRYtmg,,ZD Net
Hewlett Packard,,"Laptop lost/stolen containing employee data: names, addresses, Social Security numbers, dates of birth and other employment-related information.",2,"200,000","tech, retail",lost / stolen media,,200000,20,,,,,http://news.cnet.com/Laptop-with-HP-employee-data-stolen/2100-7348_3-6052964.html,,,CNET
Countrywide Financial Corp,Mortgage financer,,2,"2,600,000",financial,inside job,,2600000,300,,,,,http://www.idtheftcenter.org/artman2/publish/lib_survey/ITRC_2008_Breach_List.shtml,,,ITRC
KDDI,Japanese telecommunications operator,"Press report: ""Tokyo police have arrested two men for trying to extort nearly US$90,000 from KDDI Corp. The pair allegedly threatened to disclose the existence of storage media containing personal data belonging to four million KDDI customers prior to a shareholder meeting; however, KDDI alerted the police as soon as they were contacted by the blackmailers; the police monitored communications between KDDI and the pair for several weeks. """,2,"4,000,000",telecoms,hacked,,4000000,1,,,,,http://www.computerworld.com/s/article/9001150/KDDI_suffers_massive_data_breach,,,Computer World
"T-Mobile, Deutsche Telecom",,"Thieves got their hands on a storage device with the data, which included the names, addresses, cell phone numbers, and some birth dates and e-mail addresses for high-profile German citizens. The company said the records did not contain bank details, credit card numbers, or call data.",2,"17,000,000",telecoms,lost / stolen media ,,17000000,1,,,,,http://www.datalossdb.org,http://www.informationweek.com/security/attacks/t-mobile-lost-17-million-subscribers-per/210700232,,Data Loss Database
AOL,American Online,"Durp. AOL VOLUNTARILY released search data for roughly 20 million web queries from 658,000 anonymized users of the service. No one is quite sure why.",2,"20,000,000",web,accidentally published,,20000000,1,,,,,http://techcrunch.com/2006/08/06/aol-proudly-releases-massive-amounts-of-user-search-data/,,,Tech Crunch
US Dept of Vet Affairs,,The Veterans Affairs Department agreed to pay $20 million to settle a class action lawsuit over the loss of a laptop. The department originally took three weeks to report the theft. The laptop was recovered with the data apparently intact a month after it was reported stolen. But it is impossible to say with absolute certainty that the data was not accessed and copied.  ,2,"26,500,000","government, military",lost / stolen computer,,26500000,20,,,,,http://gcn.com/Articles/2009/02/02/VA-data-breach-suit-settlement.aspx,,,GCN
Automatic Data Processing,"Business outsourcing, payrolls, benefits",,1,"125,000",financial,poor security,,130000,20,,,,,http://abcnews.go.com/Technology/story?id=2160425&page=1#.UFcROxgUwaA,,,ABC
Ameritrade Inc.,Computer backup tape containing personal information was lost. ,online broker,1,"200,000",financial,lost / stolen media,,200000,20,,,,,http://www.nbcnews.com/id/7561268/,,,NBC
Citigroup,,Blame the messenger! A box of computer tapes containing information on 3.9 million customers was lost by United Parcel Service (UPS) while in transit to a credit reporting agency.,1,"3,900,000",financial,lost / stolen media ,,3900000,300,,,,,http://www.nytimes.com/2005/06/07/business/07data.html?pagewanted=all&_moc.semityn.www,,,NY Times
Cardsystems Solutions Inc. ,"Third-party payment processor for Visa, Mastercard, Amex,  and Discover","CardSystems was fingered by MasterCard after it spotted fraud on credit card accounts and found a common thread, tracing it back to CardSystems.  An unauthorized entity put a specific code into CardSystems' network, enabling the person or group to gain access to the data. It's not clear how many of the 40 million accounts were actually stolen. ",1,"40,000,000",financial,hacked,,40000000,300,,,,,http://www.msnbc.msn.com/id/8260050/ns/technology_and_science-security/t/million-credit-cards-exposed/#.UFiz7aRYtmg,,,MSNBC
AOL,American Online, A former America Online software engineer stole 92 million screen names and e-mail addresses and sold them to spammers who sent out up to 7 billion unsolicited e-mails.,0,"92,000,000",web,"inside job, hacked",,92000000,1,,,,,http://money.cnn.com/2004/06/23/technology/aol_spam/,http://www.msnbc.msn.com/id/8985989/#.UFcN8RgUwaA,,CNN
Bell,,Somebody claiming to be behind the attack has threatened Bell with more leaks if they don't cooporate. ,13,"1,900,000",telecoms,hacked,,1900000,1,,,,,http://www.cbc.ca/beta/news/technology/bell-data-breach-customer-names-phone-numbers-emails-leak-1.4116608,,,CBC
DaFont,Font sharing site,"May. Apparently the hacker found out others were selling the site's database, so he decided to get in on the action himself.",13,"700,000",web,hacked,,700000,4000,,,,,http://www.zdnet.com/article/font-sharing-site-dafont-hacked-thousands-of-accounts-stolen/,,,ZDNet
Zomato,Restaurants & events,The hacker is selling the stolen dataset for around $1000. ,13,"17,000,000",web,hacked,,17000000,4000,,,,,https://www.hackread.com/zomato-hacked-17-million-accounts-sold-on-dark-web/,,,HackRead