,,,,,,,,,,,,,,,,,
Writerspace.com,Website design and hosting for writers,"Hacker group LulzSec released the e-mails and passwords, 12,000 of which were confirmed to originate from Writerspace.com. ",7,"62,000",web,hacked,,62000,1,,,,,"http://www.pcmag.com/article2/0,2817,2387186,00.asp",,,PC Mag
University of Wisconsin - Milwaukee,,,7,"73,000",academic,hacked,,73000,20,,,,,http://www.idtheftcenter.org/artman2/publish/lib_survey/ITRC_2008_Breach_List.shtml,,,idTheftCentre
Memorial Healthcare System,Florida,"An employee of an affiliated physician’s office may have improperly accessed patient information through a web portal used by physicians who provide care and treatment at MHS. Specifically, patients’ names, dates of birth, and Social Security numbers.",7,"102,153",healthcare,lost / stolen media,,100000,20,,,,,http://www.mhs.net/pdf/release071112.pdf,http://www.hhs.gov/ocr/privacy/hipaa/administrative/breachnotificationrule/breachtool.html,,"MHS, HHS"
US Law Enforcement,,"""AntiSec"" hackers published 2,719 social security numbers, 8,214 passwords, 15,798 birth dates, 48,182 street addresses, 1,531,628 email addresses, 106,691 phone numbers, 57 bank account numbers, 53 driver's license numbers, and eight credit card numbers of more than 70 different U.S. law enforcement agencies.",7,"123,461",government,accidentally published,,130000,300,,,,,"http://www.pcmag.com/article2/0,2817,2390683,00.asp",,,PC World
Accendo Insurance Co. ,,"Mismailed letters which allowed some lines of sensitive information (medication name, date of birth, and member ID) to be visible through the envelope window. The mailings were addressed correctly and, to the knowledge of the company, were received by the intended recipients.",7,"175,350",healthcare,poor security,,180000,20,,,,,http://www.databreaches.net/?p=19198,http://www.hhs.gov/ocr/privacy/hipaa/administrative/breachnotificationrule/breachtool.html,,"DataBreaches, HHS"
San Francisco Public Utilities Commission ,,,7,"180,000",government,hacked,,180000,1,,,,,http://news.cnet.com/8301-27080_3-20068386-245/sf-utilities-agency-warns-of-potential-breach/,,,CNET
Bethesda Game Studios,"US video game company (Elder Scrolls, Fallout 3)","Hacking collective Lulzsec stole account information of 200,000 user.",7,"200,000",gaming,hacked,,200000,1,,,,,http://www.pcworld.com/article/231215/lulzsec_a_short_history_of_hacking.html,,,PC World
Restaurant Depot,"food, equipment, and supplies for restaurants",,7,"200,000",retail,hacked,,200000,300,,,,,http://www.idtheftcenter.org/artman2/publish/lib_survey/ITRC_2008_Breach_List.shtml,,,ITRC
Massachusetts Government,Massachusetts Executive Office of Labor and Workforce,"Over 1,500 departmental computers were infected with the W32.QAKBOT virus, a malicious program which “downloads additional files, steals information, and opens a back door on the compromised computer”. ",7,"210,000",government,poor security,,200000,50000,,,,,http://www.idtheftcenter.org/artman2/publish/lib_survey/ITRC_2008_Breach_List.shtml,,,ITRC
Honda Canada,,"Names, addresses and vehicle identification numbers were taken from the company’s eCommerce websites myHonda and myAcura",7,"283,000",retail,poor security,,300000,20,,,,,http://www.guelphmercury.com/news-story/2200845-honda-canada-hit-by-online-security-breach-283-000-car-owners-personal-data-stolen/,,,GuelphMercury
Southern California Medical-Legal Consultants,,"Electronic files containing names and social security numbers of approximately 300,000 individuals who have applied for California workers’ compensation benefits had been exposed to unauthorized access.",7,"300,000",healthcare,hacked,,300000,20,,,,,http://www.idtheftcenter.org/artman2/publish/lib_survey/ITRC_2008_Breach_List.shtml,,,idTheftCentre
Citigroup,,"Less than 1% of Citbank card holders' names, account numbers, and contact information such as e-mail addresses were stolen. Card security codes were not stolen. ",7,"360,083",financial,hacked,,400000,300,,,,,http://www.pcworld.com/article/229891/Citigroup_Hack_Nets_Over_200k_in_Stolen_Customer_Details.html,,,PC World
Spartanburg Regional Healthcare System,,"The stolen computer contained a password-protected file with Social Security numbers as well as names, addresses, dates of birth and medical billing codes.",7,"400,000",healthcare,lost / stolen computer,,400000,4000,,,,,http://www.goupstate.com/news/20110527/spartanburg-regional-patients-affected-by-computer-breach,http://www.hhs.gov/ocr/privacy/hipaa/administrative/breachnotificationrule/breachtool.html,,"GoupState, HHS"
Eisenhower Medical Center,California hospital,"Stolen computer contained data listing patients' names, ages, dates of birth, medical record numbers and the last four digits of their social security numbers.",7,"514,330",healthcare,lost / stolen computer,,500000,4000,,,,,http://databreachinvestigation.blogspot.com/2011/04/thief-gets-away-with-eisenhower-medical.html,http://www.hhs.gov/ocr/privacy/hipaa/administrative/breachnotificationrule/breachtool.html,,"Databreach Investigation, HHS"
Stratfor,Shadowy global intelligence company,"Hacking collective Anonymous defaced the website of Stratfor and posted a file online of the organization’s confidential client list, along with credit card details, passwords and home addresses for those clients. They released 47,680 unique e-mail addresses and 50,277 unique credit card numbers — 9,651 of which were not yet expired. Of the stolen encrypted passwords, 50% were easily crackable. ",7,"935,000",military,accidentally published,,900000,300,,,,,http://bits.blogs.nytimes.com/2011/12/27/questions-about-motives-behind-stratfor-hack/,,,NY Times
Oregon Department of Motor Vehicles,,"Sheriff's detectives arrested Tim Nuss  for accessing an old Oregon Department of Motor Vehicles database. The DMV database was once sold to marketing companies, but the department stopped selling the information in the late 1990s. The sold data include the names, addresses, birth dates, gender and ages of people who registered with the DMV, but no financial information.  ",7,"1,000,000",government,poor security,,1000000,20,,,,,http://www.idtheftcenter.org/artman2/publish/lib_survey/ITRC_2008_Breach_List.shtml,,,ITRC
Sony Pictures,,"LulzSec hacking collective stated all of the information it took was unencrypted, “Sony stored over 1,000,000 passwords of its customers in plaintext."" More than 1 million user accounts were compromised. An additional 75,000 music codes and 3.5 million coupons were also uncovered.",7,"1,000,000",web,hacked,,1000000,1,,,,,http://mashable.com/2011/06/02/sony-pictures-hacked/,,,Mashable
Nemours Foundation,US children's hospitals,A health care organization that runs children’s hospitals reported the loss of 1.05 million records when data backup tapes were lost.,7,"1,055,489",healthcare,lost / stolen media ,,1100000,4000,,,,,http://zerosecurity.org/technews/past-three-years-over-21m-medical-record-breaches/,http://www.hhs.gov/ocr/privacy/hipaa/administrative/breachnotificationrule/breachtool.html,,"HHS, ZeroSecurity"
Washington Post,,Unknown hackers broke into The Washington Post's jobs website stealing about 1.27 million user IDs and email addresses.,7,"1,270,000",media,hacked,,1300000,20,,,,,"http://www.pcmag.com/article2/0,2817,2388200,00.asp",,,PC Mag
Sega,,"Information stolen during the hack includes names, birth dates, e-mail addresses and passwords from Sega Pass, a system for users interested in newsletters and for registering certain products. ",7,"1,290,755",gaming,hacked,,1300000,20,,,,, http://www.zdnet.com/blog/gamification/sega-1-3-million-customer-records-hacked-lulzsec-promises-retribution/481,,,ZD Net
Health Net - IBM,Data lost from HN servers managed by IBM,"Several server drives, containing personal information of former and current employees, went missing.",7,"1,900,000",healthcare,lost / stolen media ,,1900000,300,,,,,http://www.idtheftcenter.org/artman2/publish/lib_survey/ITRC_2008_Breach_List.shtml,http://www.hhs.gov/ocr/privacy/hipaa/administrative/breachnotificationrule/breachtool.html,,ITRC
Countrywide Financial Corp,Employee convicted of downloading millions of borrower files and selling the information to other loan officers.,mortgage lender,7,"2,500,000",financial,inside job,,2500000,20,,,,,http://latimesblogs.latimes.com/money_co/2011/09/man-convicted-in-huge-countrywide-data-theft-gets-8-months-in-prison.html,,,LATimes
State of Texas,,"3.5 million records were accidentally published online including people's names, mailing addresses, social security numbers, and in some cases dates of birth and driver's license numbers.",7,"3,500,000",government,accidentally published,,3500000,20,,,,,http://www.informationweek.com/security/attacks/texas-data-breach-exposed-35-million-rec/229401489?queryText=Texas%20data%20leak,,,Information Week
Sutter Medical Foundation,,"A password protected but unencrypted company computer was stolen. The compromised database contained names, addresses, dates of birth, phone numbers, email addresses, medical record numbers and the name of each patient's health insurance plan. No medical records were stored on the computer.",7,"4,243,434",healthcare,lost / stolen computer,,4200000,20,,,,,http://www.simplysecurity.com/2011/11/30/sutter-health-sued-for-1-billion-following-data-breach/,http://www.hhs.gov/ocr/privacy/hipaa/administrative/breachnotificationrule/breachtool.html,,"HHS, Simply Security"
Tricare,Healthcare service for US Military,"The information for some 4.6 million active and retired military personnel, as well as their families, was on back up-tapes from an electronic health care record used to capture and preserve patient data from 1992 through September 7 2011. ",7,"4,901,432","military, healthcare",lost / stolen computer,,4900000,4000,,,,,http://www.reuters.com/article/us-data-breach-texas-idUSTRE78S5JG20110929,,,ITRC
China Software Developer Network,,,7,"6,000,000",web,hacked,,6000000,1,,,,,http://www.zdnet.com/blog/security/chinese-hacker-arrested-for-leaking-6-million-logins/11064,,,ZDNet
NHS,"UK's national health service, govt funded",A laptop holding the unencrypted records of eight million patients went missing from an NHS store room and wasn't reported until 3 weeks later. ,7,"8,300,000",healthcare,lost / stolen media ,,8300000,4000,,,,,http://www.techweekeurope.co.uk/news/nhs-researchers-lose-laptop-with-8m-patients-records-31810,,,Tech Week
178.com,,gaming website,7,"10,000,000",web,hacked,,10000000,1,,,,,http://www.ehackingnews.com/2011/12/hackers-compromised-38-million-chinese.html,,,eHackingNews
Nexon Korea Corp,Personal data of subscribers to online game Maple Story was leaked.,game developer,7,"13,200,000",web,hacked,,13200000,20,,,,,http://www.reuters.com/article/2011/11/26/us-korea-hacking-nexon-idUSTRE7AP09H20111126,,,Reuters
Sony Online Entertainment,,"Hacked by LulzSec. In addition to the Sony Playstation Network breach, compromised 77 million records. More than 23,000 lost financial data, according to Sony.",7,"24,600,000",gaming,hacked,,24600000,300,,,,,http://www.computerworld.com/s/article/9216343/Sony_cuts_off_Sony_Online_Entertainment_service_after_hack,,,Computer World
Tianya,"Usernames, clear tect passwords and email addresses hacked. ",blogging site,7,"28,000,000",web,hacked,,28000000,1,,,,,"http://www.scmagazine.com.au/News/349585,28-million-clear-text-passwords-found-after-tianya65279-hack.aspx",,,SCMagazine
Steam,Attackers used login details from a Steam forum hack to access a database that held ID and credit card data.,The Valve Corporation,7,"35,000,000",web,hacked,,35000000,300,,,,,http://www.bbc.co.uk/news/technology-15690187,,,BBC
Sony PSN,,"Rounding off a thoroughly unhappy year for Sony, their third breach saw the loss of 76,000,000 Sony PSN and Qriocity user accounts to hacking collective Lulzsec.",7,"77,000,000",gaming,hacked,,77000000,1,,,,,http://mashable.com/2011/05/31/sony-playstation-services-return/,,,Mashable
Yale University,,,6,"43,000",academic,accidentally published,,40000,20,,,,,http://www.idtheftcenter.org/artman2/publish/lib_survey/ITRC_2008_Breach_List.shtml,,,ITRC
Colorado government,Department of Health Care Policy & Financing,,6,"105,470",healthcare,lost / stolen computer,,100000,20,,,,,http://www.databreaches.net/?p=12611,http://www.hhs.gov/ocr/privacy/hipaa/administrative/breachnotificationrule/breachtool.html,,"HHS, Databreaches"
AT&T,US Telecoms company,"Details of iPad 3G users hacked from AT&T website, thought to include those of White House chief of staff Rahm Emanuel.",6,"114,000",telecoms,hacked,,100000,1,,,,,http://www.guardian.co.uk/technology/2010/jun/10/apple-ipad-security-leak?INTCMP=SRCH,,,Guardian
Lincoln Medical & Mental Health Center,,"130,495 patients lost their protected health information after seven CDs were lost in transit.",6,"130,495",healthcare,lost / stolen media ,,130000,4000,,,,,http://www.phiprivacy.net/?tag=lincoln-medical-and-mental-health-center,http://www.hhs.gov/ocr/privacy/hipaa/administrative/breachnotificationrule/breachtool.html,,"HHS, Phiprivacy"
"Ankle & foot Center of Tampa Bay, Inc.",,"The information hacked included information such as patient names, social security numbers, date of birth, home addressees, account numbers, and healthcare services and related diagnostic codes.",6,"156,000",healthcare,hacked,,160000,4000,,,,,http://www.phiprivacy.net/?p=5743,http://www.hhs.gov/ocr/privacy/hipaa/administrative/breachnotificationrule/breachtool.html,,"PhiPrivacy, HHS"
"Emergency Healthcare Physicians, Ltd.",A Chicago emergency physician group,"The stolen portable hard drive is believed to have contained records from 2003 to 2006 that included patient names, addressees, phone numbers, birth dates, Social Security numbers, and, in some cases, drivers' license numbers.",6,"180,111",healthcare,lost / stolen media,,180000,4000,,,,,http://www.healthcareinfosecurity.com/chicago-breach-affects-180000-a-2496,http://www.hhs.gov/ocr/privacy/hipaa/administrative/breachnotificationrule/breachtool.html,,"HHS, Healthcareinfosecurity"
"Seacoast Radiology, PA",,"Computer gamers hacked a server at Seacoast Radiology in Rochester in search of more bandwidth in November to play Call of Duty: Black Ops. In the process they also gained access to personal records of the more than 230,000 patients of the health center.",6,"231,400",healthcare,hacked,,200000,20,,,,,http://www.fosters.com/apps/pbcs.dll/article?AID=/20110120/GJNEWS_01/701209744,http://www.hhs.gov/ocr/privacy/hipaa/administrative/breachnotificationrule/breachtool.html,,
Embassy Cables,"Confidential communications between 274 embassies in countries throughout the world and the State Department in Washington DC, between 1966-2010.",Wikileaks,6,"251,000",government,inside job,,300000,50000,,,,,http://wikileaks.org/cablegate.html,,,Wikileaks
US Military,Wikileaks / Bradley Manning/Cablegate.,WIKILEAKS!,6,"260,000",military,inside job,,300000,50000,,,,,http://www.guardian.co.uk/news/datablog/2010/nov/29/wikileaks-cables-data,,,Guardian
Classified Iraq War documents,,Wikileaks,6,"392,000",government,inside job,,400000,20,,,,,http://www.forbes.com/sites/andygreenberg/2010/10/22/wikileaks-reveals-the-biggest-classified-data-breach-in-history/,,,Forbes
"Triple-S Salud, Inc.",Puerto-Rican health insurance company,,6,"398,000",healthcare,lost / stolen media,,400000,4000,,,,,https://www.databreaches.net/puerto-rico-dept-of-health-reports-breach-affecting-400000-triple-s-salud-fined-100k/,,,Data Breaches
US Federal Reserve Bank of Cleveland,,"A Malaysian man has been charged with hacking into major U.S. corporations, including the U.S. Federal Reserve Bank of Cleveland and FedComp after U.S. Secret Service investigators found more than ""400,000 stolen credit and debit card account numbers allegedly obtained by hacking into various computer systems of other financial institutions""",6,"400,000",financial,hacked,,400000,300,,,,,http://www.idtheftcenter.org/artman2/publish/lib_survey/ITRC_2008_Breach_List.shtml,,,ITRC
Puerto Rico Department of Health,,"Double whammy. Two separate breaches. On September 3rd, 2010 data on 115,000 people was stolen from unauthorized access of an electronic device, on the 21st they reported an additional 400,000 records were hacked. ",6,"515,000",healthcare,hacked,,500000,4000,,,,,http://www.hhs.gov/ocr/privacy/hipaa/administrative/breachnotificationrule/breachtool.html,,,HHS
Ohio State University,,,6,"760,000",academic,hacked,,800000,20,,,,,http://www.idtheftcenter.org/artman2/publish/lib_survey/ITRC_2008_Breach_List.shtml,,,ITRC
"South Shore Hospital, Massachusetts",,"South Shore Hospital hired a contractor to destroy files no longer in use and lost the shipment. The back-up computer files possibly contained names, addresses, phone numbers, dates of birth, Social Security numbers, driver’s license numbers, medical record numbers, patient numbers, health plan information, protected health information including diagnoses and treatments. As well as bank account and credit card numbers for some. Patients, employees, physicians, volunteers, donors, vendors and other business partners were effected. ",6,"800,000",healthcare,lost / stolen media ,,800000,50000,,,,,http://www.idtheftcenter.org/artman2/publish/lib_survey/ITRC_2008_Breach_List.shtml,,,ITRC
Gawker.com,US news and gossip blog network including Gawker.com Gizmodo.com Lifehacker.com,"Hacked. 1.5 Million usernames, emails, passwords taken.",6,"1,500,000",web,hacked,,1500000,20,,,,,http://www.guardian.co.uk/technology/2010/dec/13/gawker-hackers-passwords-twitter-wikileaks?INTCMP=SRCH,http://www.mediaite.com/online/gawker-medias-entire-commenter-database-appears-to-have-been-hacked/,,Guardian
New York City Health & Hospitals Corp.,New York City Health & Hospitals Corporation's North Bronx Healthcare Network,,6,"1,700,000",healthcare,lost / stolen media ,,1700000,4000,,,,,http://www.hhs.gov/ocr/privacy/hipaa/administrative/breachnotificationrule/breachtool.html,,,HHS
Betfair,UK gambling site,"Betfair waited 18 months to report the breach of their online gambling site, alarming banking institutions and security experts. Betfair's systems breach, which occurred in March and April 2010, was not uncovered until this past May, when a server crashed.",6,"2,300,000",web,hacked,,2300000,300,,,,,http://www.idtheftcenter.org/artman2/publish/lib_survey/ITRC_2008_Breach_List.shtml,,,ITRC
JP Morgan Chase,,"In 2007, the personal information of approximately 2.6 million current and former holders of a Chase-Circuit City credit card had been mistakenly identified as trash and thrown out in garbage bags outside five branch offices in New York.",6,"2,600,000",financial,lost / stolen media ,,2600000,300,,,,,http://www.pcworld.com/article/131453/article.html,,,ITRC
Educational Credit Management Corp,US student loan guarantor,"A contractor for the US Department of Education stole the records of 3.3 million people. Data included names, addresses, Social Security numbers and dates of birth of borrowers, but no financial or bank account information.",6,"3,300,000",financial,lost / stolen media,,3300000,20,,,,,http://www.foxnews.com/us/2010/03/26/student-loan-company-data-m-people-stolen/,,,ITRC
US Dept of Defense,,"""According to a report to Congress, assessment forms of 72,000 service members who returned from deployment to Iraq or Afghanistan between Jan 1, 2007 to May 31, 2008 were breached. The forms ask for the service member's SSN,. Name, date of birth.""",5,"72,000",military,lost / stolen media ,,72000,20,,,,,http://www.idtheftcenter.org/artman2/publish/lib_survey/ITRC_2008_Breach_List.shtml,,,ITRC
US National Guard,,"About 131,000 former and current Army Guard members potentially affected  when a personal laptop owned by an Army Guard contractor was stolen. Database incuded names, Social Security Numbers, incentive payment amounts and payment dates.",5,"131,000",military,lost / stolen computer,,130000,20,,,,,http://www.idtheftcenter.org/artman2/publish/lib_survey/ITRC_2008_Breach_List.shtml,,,ITRC
University of California Berkeley,"details on students, alumni and others",,5,"160,000",academic,hacked,,160000,300,,,,,http://www.msnbc.msn.com/id/30645920/ns/technology_and_science-security/t/hackers-breach-uc-berkeley-computers/#.UFjFaKRYtmg,,,ITRC
"Affinity Health Plan, Inc.",,A rented photocopier used to copy health records did not have its hard-drive wiped before its return. ,5,"344,579",healthcare,lost / stolen media ,,300000,4000,,,,,http://security-hack1.blogspot.com/2010/04/affinity-health-plan-alerts-public.html,http://www.hhs.gov/ocr/privacy/hipaa/administrative/breachnotificationrule/breachtool.html,,"Security Hack, Government Security"
Virginia Prescription Monitoring Program,,"A hacker, who was never arrested, demanded a $10 million ransom for a breach effecting 530,000 Virginians. Social security numbers may have been taken. The data was found in a database containing 35 million prescription records.",5,"531,400",healthcare,hacked,,500000,20,,,,,http://www.idtheftcenter.org/artman2/publish/lib_survey/ITRC_2008_Breach_List.shtml,,,ITRC
Network Solutions,Domain name registration business,"A large-scale infection of WordPress-driven blogs with malicious code led to the compromise of 573,000 debit and credit cards.",5,"573,000",tech,hacked,,600000,300,,,,,http://www.computerworld.com/s/article/9175783/Network_Solutions_sites_hacked_again,http://voices.washingtonpost.com/securityfix/2009/07/network_solutions_hack_comprom.html,,ITRC
Blue Cross Blue Shield of Tennessee,US health insurance organization,"A thief stole 57 hard drives from the closet of a BlueCross call center in Chattanooga, Tenn. Data on the stolen hard drives was encoded but not encrypted. Bluecross stated there was no evidence the information was accessed due to the specialized nature of the hardware stolen. ",5,"1,023,209",healthcare,lost / stolen media ,,1000000,20,,,,,http://www.scmagazine.com/thief-steals-57-hard-drives-from-bluecross-blueshield-of-tennessee/article/162178/,http://www.hhs.gov/ocr/privacy/hipaa/administrative/breachnotificationrule/breachtool.html,,ITRC
"AvMed, Inc.",,"Two company laptops containing names, addresses, dates of birth, Social Security numbers and health-related information. ",5,"1,220,000",healthcare,lost / stolen computer,,1200000,20,,,,,http://www.governmentsecurity.org/latest-security-news/laptop-theft-exposes-private-info-of-avmed-health-plansaapos-customers.html,http://www.hhs.gov/ocr/privacy/hipaa/administrative/breachnotificationrule/breachtool.html,,"HHS, Government Security"
Health Net ,Largest US publicly traded managed health care company,A portable hard drive with seven years of personal and medical information on about 1.5 million Health Net customers was lost for six months before being reported. ,5,"1,500,000",healthcare,lost / stolen media ,,1500000,4000,,,,,http://www.idtheftcenter.org/artman2/publish/lib_survey/ITRC_2008_Breach_List.shtml,,,ITRC
CheckFree Corporation,"Provider of online banking, online bill payment and electronic bill payment services for the financial services industry",Customers who went to CheckFree's Web sites between 12:35 a.m. and 10:10 a.m. on the day of the attack were redirected to a Ukrainian Web server that used malicious software to try and install a password-stealing program on the victim's computer.,5,"5,000,000",financial,hacked,,5000000,1,,,,,http://www.computerworld.com/s/article/9125078/CheckFree_warns_5_million_customers_after_hack,,,Computer World
Virginia Dept. Of Health,,An extortion demand posted on WikiLeaks sought $10 million to return over 8 million patient records and 35 million prescriptions allegedly stolen from Virginia Department of Health Professions.  All 36 servers were shut down  to protect records.,5,"8,257,378","government, healthcare",hacked,,8300000,4000,,,,,http://www.idtheftcenter.org/artman2/publish/lib_survey/ITRC_2008_Breach_List.shtml,,,ITRC
RockYou!,Developer of online games (Zoo World/Zoo World 2) and advertising products,"The site did not allow users to use special characters or punctuation in their passwords and e-mailed user passwords in plain text. Hackers took advantage of these security lapses, using simple techniques to gain access to 32 million user accounts.",5,"32,000,000","web, gaming",hacked,,32000000,1,,,,,http://techcrunch.com/2009/12/14/rockyou-hack-security-myspace-facebook-passwords/,,,Tech Crunch
US Military,,"Without first destroying the data the agency sent back a defective unencrypted hard drive for repair and recycling which held detailed records on 76 million veterans, including millions of Social Security numbers dating to 1972.",5,"76,000,000",military,lost / stolen media ,,76000000,20,,,,,http://www.wired.com/threatlevel/2009/10/probe-targets-archives-handling-of-data-on-70-million-vets/,,,ITRC
Heartland,Independent payment processor,"The biggest credit card scam in history, Heartland eventually paid more than $110 million to Visa, MasterCard, American Express and other card associations to settle claims related to the breach.",5,"130,000,000",financial,hacked,,130000000,300,,,,,http://www.forbes.com/sites/davelewis/2015/05/31/heartland-payment-systems-suffers-data-breach/#155d10312985,,,Guardian
Service Personnel and Veterans Agency (UK),,Stolen USBs containing personal information about private lives of staff. ,4,"50,500",government,lost / stolen media,,50000,20,,,,,http://news.bbc.co.uk/1/hi/england/gloucestershire/7639006.stm,,,BBC
